{
  "aop_version": "0.4",
  "decision_id": "dec_20260304T000002Z_0002",
  "policy_id": "urn:aop:policy:deny-high-side-effects:v1",
  "target": {
    "selector": "object_id",
    "object_id": "urn:aop:tool:dangerous-write:v1"
  },
  "decision": {
    "effect": "deny",
    "strategy": "deny_overrides",
    "rule_ids": ["deny-high-effects"]
  },
  "reasons": [
    {
      "code": "DENY_HIGH_SIDE_EFFECTS",
      "message": "High side effects require explicit approval.",
      "rule_id": "deny-high-effects"
    }
  ],
  "patches": [
    {
      "type": "require",
      "operations": [
        {
          "op": "add",
          "path": "x-acme-approval-ticket",
          "value": "REQUIRED"
        }
      ]
    }
  ],
  "timestamp": "2026-03-04T05:26:22+08:00"
}
